{
  "name": "Nexus 5",
  "codename": "hammerhead",
  "unlock": ["confirm_model"],
  "user_actions": {
    "recovery": {
      "title": "Reboot to Recovery",
      "description": "Press and hold the volume down and power buttons until the phone reboots. Use the volume keys to select recovery mode and confirm with the power button.",
      "image": "phone_power_down",
      "button": true
    },
    "bootloader": {
      "title": "Reboot to Bootloader",
      "description": "Press and hold the volume down and power buttons until the phone reboots.",
      "image": "phone_power_down",
      "button": true
    },
    "confirm_model": {
      "title": "Confirm your model",
      "description": "Please double-check that your device is an LG Nexus 5 (hammerhead). The LG Nexus 5x (bullhead) is not compatible."
    }
  },
  "operating_systems": [
    {
      "name": "Ubuntu Touch",
      "sanity_check": "Are you sure?",
      "options": [
        {
          "var": "channel",
          "name": "Channel",
          "tooltip": "The release channel",
          "link": "https://docs.ubports.com/en/latest/about/process/release-schedule.html",
          "type": "select",
          "remote_values": { "type": "systemimagechannels" }
        },
        {
          "var": "wipe",
          "name": "Wipe Userdata",
          "tooltip": "Wipe personal data",
          "type": "checkbox"
        },
        {
          "var": "bootstrap",
          "name": "Bootstrap",
          "tooltip": "Flash system partitions using fastboot",
          "type": "checkbox",
          "value": true
        }
      ],
      "prerequisites": [],
      "steps": [
        {
          "type": "download",
          "condition": {"var": "bootstrap", "value": true},
          "group": "firmware",
          "files": [
            {
              "url": "http://cdimage.ubports.com/devices/recovery-hammerhead.img",
              "checksum": "91b681a3287808a79e21c2ac17f85537c6c9b23fb009b5e491c2ccf28986856c"
            },
            {
              "url": "http://cdimage.ubports.com/devices/boot-hammerhead.img",
              "checksum": "3f39372bdac0a6a8bd6507683a87da16e74346152525e12d6ea46418a88c62c3"
            }
          ]
        },
        {
          "type": "adb:reboot",
          "condition": {"var": "bootstrap", "value": true},
          "to_state": "bootloader",
          "fallback_user_action": "bootloader"
        },
        {
          "type": "fastboot:flash",
          "condition": {"var": "bootstrap", "value": true},
          "flash": [
            {
              "partition": "boot",
              "file": "boot-hammerhead.img",
              "group": "firmware"
            },
            {
              "partition": "recovery",
              "file": "recovery-hammerhead.img",
              "group": "firmware"
            }
          ]
        },
        {
          "type": "fastboot:erase",
          "condition": {"var": "bootstrap", "value": true},
          "partition": "cache"
        },
        {
          "type": "fastboot:boot",
          "condition": {"var": "bootstrap", "value": true},
          "file": "recovery-hammerhead.img",
          "fallback_user_action": "recovery",
          "group": "firmware"
        },
        {
          "type": "adb:reboot",
          "condition": {"var": "bootstrap", "value": false},
          "to_state": "recovery",
          "fallback_user_action": "recovery"
        },
        {
          "type": "adb:format",
          "partition": "cache"
        },
        {
          "type": "systemimage"
        },
        {
          "type": "adb:reboot",
          "to_state": "recovery",
          "fallback_user_action": "recovery"
        }
      ],
      "slideshow": []
    }
  ]
}
