{
  "name": "Bq Aquaris E4.5",
  "codename": "krillin",
  "unlock": ["unlock"],
  "user_actions": {
    "recovery": {
      "title": "Reboot to Recovery",
      "description": "With the device turned off, hold the volume up and power button until the phone boots. Then use the volume up button to select recovery mode and confirm with volume down.",
      "image": "phone_power_up",
      "button": true
    },
    "bootloader": {
      "title": "Reboot to Bootloader",
      "description": "With the device turned off, hold the volume up and power button until the phone boots. Then use the volume up button to select fastboot/bootloader mode and confirm with volume down.",
      "image": "phone_power_up",
      "button": true
    },
    "unlock": {
      "title": "Unlock",
      "description": "If the device is running Android, it needs to be manually unlocked for the Installer to work. This is achieved by first installing a very old version of Canonical's Ubuntu Touch using an OEM tool, which is a manual process. Click the link below to find out more. If the device is already running Ubuntu Touch, you can simply ignore this message.",
      "link": "https://docs.ubports.com/en/latest/userguide/install.html#install-on-legacy-android-devices"
    }
  },
  "operating_systems": [
    {
      "name": "Ubuntu Touch",
      "sanity_check": "Are you sure?",
      "options": [
        {
          "var": "channel",
          "name": "Channel",
          "tooltip": "The release channel",
          "link": "https://docs.ubports.com/en/latest/about/process/release-schedule.html",
          "type": "select",
          "remote_values": { "type": "systemimagechannels" }
        },
        {
          "var": "wipe",
          "name": "Wipe Userdata",
          "tooltip": "Wipe personal data",
          "type": "checkbox"
        },
        {
          "var": "bootstrap",
          "name": "Bootstrap",
          "tooltip": "Flash system partitions using fastboot",
          "type": "checkbox",
          "value": true
        }
      ],
      "prerequisites": [],
      "steps": [
        {
          "type": "download",
          "condition": {"var": "bootstrap", "value": true},
          "group": "recovery",
          "files": [
            {
              "url": "http://cdimage.ubports.com/devices/recovery-krillin.img",
              "checksum": "d2b57e9f886e55c263bcff9ba7553d2cb0e00d74411490bfb62f252cda3a86e5"
            }
          ]
        },
        {
          "type": "adb:reboot",
          "condition": {"var": "bootstrap", "value": true},
          "to_state": "bootloader",
          "fallback_user_action": "bootloader"
        },
        {
          "type": "fastboot:flash",
          "condition": {"var": "bootstrap", "value": true},
          "flash": [
            {
              "partition": "recovery",
              "file": "recovery-krillin.img",
              "group": "recovery"
            }
          ]
        },
        {
          "type": "fastboot:boot",
          "condition": {"var": "bootstrap", "value": true},
          "file": "recovery-krillin.img",
          "fallback_user_action": "recovery",
          "group": "recovery"
        },
        {
          "type": "adb:reboot",
          "condition": {"var": "bootstrap", "value": false},
          "to_state": "recovery",
          "fallback_user_action": "recovery"
        },
        {
          "type": "adb:format",
          "partition": "cache"
        },
        {
          "type": "systemimage"
        },
        {
          "type": "adb:reboot",
          "to_state": "recovery",
          "fallback_user_action": "recovery"
        }
      ],
      "slideshow": []
    }
  ]
}
