{
  "name": "Nexus 7 2013 WiFi",
  "codename": "flo",
  "unlock": [],
  "user_actions": {
    "recovery": {
      "title": "Reboot to Recovery",
      "description": "With the device powered off, hold Volume Down + Power until the bootloader appears, then release the buttons. Use the volume buttons to scroll to “RECOVERY” and press Power to select.",
      "image": "phone_power_down",
      "button": true
    },
    "bootloader": {
      "title": "Reboot to Bootloader",
      "description": "With the device powered off, hold Volume Down + Power until the bootloader appears.",
      "image": "phone_power_down",
      "button": true
    },
    "confirm_model": {
      "title": "Confirm your model",
      "description": "Please double-check that your device is an LG Nexus 7 2013 WiFi (flo). If you have the LTE version (deb), you have to select that instead. The 2012 version is not compatible."
    }
  },
  "operating_systems": [
    {
      "name": "Ubuntu Touch",
      "sanity_check": "Are you sure?",
      "options": [
        {
          "var": "channel",
          "name": "Channel",
          "tooltip": "The release channel",
          "link": "https://docs.ubports.com/en/latest/about/process/release-schedule.html",
          "type": "select",
          "remote_values": { "type": "systemimagechannels" }
        },
        {
          "var": "wipe",
          "name": "Wipe Userdata",
          "tooltip": "Wipe personal data",
          "type": "checkbox"
        },
        {
          "var": "bootstrap",
          "name": "Bootstrap",
          "tooltip": "Flash system partitions using fastboot",
          "type": "checkbox",
          "value": true
        },
        {
          "var": "format",
          "name": "Format system partitions",
          "tooltip": "Needed if the device is coming from android. This will lead to data-loss.",
          "type": "checkbox",
          "value": false
        }
      ],
      "prerequisites": [],
      "steps": [
        {
          "type": "download",
          "condition": {"var": "bootstrap", "value": true},
          "group": "firmware",
          "files": [
            {
              "url": "https://gitlab.com/ubports/community-ports/flo/raw/76f6151b1291fe1cf8739d2b080c83543a62a051/partitions/recovery.img",
              "checksum": "cdbf7a58ff49a55a977b43a933625f6b8845687259d6b96bc5047f197bde49e6"
            },
            {
              "url": "https://gitlab.com/ubports/community-ports/flo/raw/76f6151b1291fe1cf8739d2b080c83543a62a051/partitions/boot.img",
              "checksum": "c288f81ae5e71b8be91c446932ff734dcd251c035bd368804a04f6b5fa21dcb6"
            }
          ]
        },
        {
          "type": "adb:reboot",
          "condition": {"var": "bootstrap", "value": true},
          "to_state": "bootloader",
          "fallback_user_action": "bootloader"
        },
        {
          "type": "fastboot:flash",
          "condition": {"var": "bootstrap", "value": true},
          "flash": [
            {
              "partition": "boot",
              "file": "boot.img",
              "group": "firmware"
            },
            {
              "partition": "recovery",
              "file": "recovery.img",
              "group": "firmware"
            }
          ]
        },
        {
          "type": "fastboot:erase",
          "condition": {"var": "bootstrap", "value": true},
          "partition": "cache"
        },
        {
          "type": "fastboot:boot",
          "condition": {"var": "bootstrap", "value": true},
          "file": "recovery.img",
          "fallback_user_action": "recovery",
          "group": "firmware"
        },
        {
          "type": "adb:reboot",
          "condition": {"var": "bootstrap", "value": false},
          "to_state": "recovery",
          "fallback_user_action": "recovery"
        },
        {
          "type": "adb:format",
          "condition": {"var": "format", "value": true},
          "partition": "system"
        },
        {
          "type": "adb:format",
          "condition": {"var": "format", "value": true},
          "partition": "data"
        },
        {
          "type": "adb:format",
          "partition": "cache"
        },
        {
          "type": "systemimage"
        },
        {
          "type": "adb:reboot",
          "to_state": "recovery",
          "fallback_user_action": "recovery"
        }
      ],
      "slideshow": []
    }
  ]
}
