{
  "name": "Nexus 7 2013 LTE",
  "codename": "deb",
  "unlock": ["confirm_model"],
  "user_actions": {
    "recovery": {
      "title": "Reboot to Recovery",
      "description": "With the device powered off, hold Volume Down + Power until the bootloader appears, then release the buttons. Use the volume buttons to scroll to “RECOVERY” and press Power to select.",
      "image": "phone_power_down",
      "button": true
    },
    "bootloader": {
      "title": "Reboot to Bootloader",
      "description": "With the device powered off, hold Volume Down + Power until the bootloader appears.",
      "image": "phone_power_down",
      "button": true
    },
    "confirm_model": {
      "title": "Confirm your model",
      "description": "Please double-check that your device is an LG Nexus 7 2013 LTE (deb). If you have the wifi-only version (flo), you have to select that instead. The 2012 version is not compatible."
    }
  },
  "operating_systems": [
    {
      "name": "Ubuntu Touch",
      "sanity_check": "Are you sure?",
      "options": [
        {
          "var": "channel",
          "name": "Channel",
          "tooltip": "The release channel",
          "link": "https://docs.ubports.com/en/latest/about/process/release-schedule.html",
          "type": "select",
          "remote_values": { "type": "systemimagechannels" }
        },
        {
          "var": "wipe",
          "name": "Wipe Userdata",
          "tooltip": "Wipe personal data",
          "type": "checkbox"
        },
        {
          "var": "bootstrap",
          "name": "Bootstrap",
          "tooltip": "Flash system partitions using fastboot",
          "type": "checkbox",
          "value": true
        },
        {
          "var": "format",
          "name": "Format system partitions",
          "tooltip": "Needed if the device is coming from android. This will lead to data-loss.",
          "type": "checkbox",
          "value": false
        }
      ],
      "prerequisites": [],
      "steps": [
        {
          "type": "download",
          "condition": {"var": "bootstrap", "value": true},
          "group": "firmware",
          "files": [
            {
              "url": "http://cdimage.ubports.com/devices/recovery-deb.img",
              "checksum": "432ee1d970b3b18e74fc80e5c0d091d87598505fe371676b80d20b16df2ea089"
            }
          ]
        },
        {
          "type": "adb:reboot",
          "condition": {"var": "bootstrap", "value": true},
          "to_state": "bootloader",
          "fallback_user_action": "bootloader"
        },
        {
          "type": "fastboot:flash",
          "condition": {"var": "bootstrap", "value": true},
          "flash": [
            {
              "partition": "recovery",
              "file": "recovery-deb.img",
              "group": "firmware"
            }
          ]
        },
        {
          "type": "fastboot:erase",
          "condition": {"var": "bootstrap", "value": true},
          "partition": "cache"
        },
        {
          "type": "fastboot:boot",
          "condition": {"var": "bootstrap", "value": true},
          "file": "recovery-deb.img",
          "fallback_user_action": "recovery",
          "group": "firmware"
        },
        {
          "type": "adb:reboot",
          "condition": {"var": "bootstrap", "value": false},
          "to_state": "recovery",
          "fallback_user_action": "recovery"
        },
        {
          "type": "adb:format",
          "condition": {"var": "format", "value": true},
          "partition": "system"
        },
        {
          "type": "adb:format",
          "condition": {"var": "format", "value": true},
          "partition": "data"
        },
        {
          "type": "adb:format",
          "partition": "cache"
        },
        {
          "type": "systemimage"
        },
        {
          "type": "adb:reboot",
          "to_state": "recovery",
          "fallback_user_action": "recovery"
        }
      ],
      "slideshow": []
    }
  ]
}
