{
  "name": "Sony Xperia X",
  "codename": "suzu",
  "unlock": [],
  "user_actions": {
    "recovery": {
      "title": "Reboot to Recovery",
      "description": "With the device powered off, hold Volume Down + Power.",
      "image": "phone_power_down",
      "button": true
    },
    "bootloader": {
      "title": "Reboot to Bootloader",
      "description": "With the device powered off, hold Volume Up + Power. The LED indicator has to light up blue.",
      "image": "phone_power_up",
      "button": true
    },
    "boot": {
      "title": "Boot the device",
      "description": "Power on the device.",
      "image": "phone_power_up",
      "button": true
    }
  },
  "operating_systems": [
    {
      "name": "Ubuntu Touch",
      "sanity_check": "Are you sure?",
      "options": [
        {
          "var": "channel",
          "name": "Channel",
          "tooltip": "The release channel",
          "link": "https://docs.ubports.com/en/latest/about/process/release-schedule.html",
          "type": "select",
          "remote_values": { "type": "systemimagechannels" }
        },
        {
          "var": "wipe",
          "name": "Wipe Userdata",
          "tooltip": "Wipe personal data",
          "type": "checkbox"
        },
        {
          "var": "bootstrap",
          "name": "Bootstrap",
          "tooltip": "Flash system partitions using fastboot",
          "type": "checkbox",
          "value": true
        }
      ],
      "prerequisites": [],
      "steps": [
        {
          "type": "download",
          "condition": {"var": "bootstrap", "value": true},
          "group": "firmware",
          "files": [
            {
              "url": "https://ci.ubports.com/view/Device%20Builds/job/halium-suzu/lastSuccessfulBuild/artifact/halium-boot_suzu.img"
            },
            {
              "url": "https://ci.ubports.com/view/Device%20Builds/job/halium-suzu/lastSuccessfulBuild/artifact/halium-unlocked-recovery_suzu.img"
            }
          ]
        },
        {
          "type": "adb:reboot",
          "condition": {"var": "bootstrap", "value": true},
          "to_state": "bootloader",
          "fallback_user_action": "bootloader"
        },
        {
          "type": "fastboot:flash",
          "condition": {"var": "bootstrap", "value": true},
          "flash": [
            {
              "partition": "boot",
              "file": "halium-boot_suzu.img",
              "group": "firmware"
            },
            {
              "partition": "recovery",
              "file": "halium-unlocked-recovery_suzu.img",
              "group": "firmware"
            }
          ]
        },
        {
          "type": "fastboot:erase",
          "condition": {"var": "bootstrap", "value": true},
          "partition": "cache"
        },
        {
          "type": "fastboot:flash",
          "condition": {"var": "bootstrap", "value": true},
          "flash": [
            {
              "partition": "boot",
              "file": "halium-unlocked-recovery_suzu.img",
              "group": "firmware"
            },
            {
              "partition": "recovery",
              "file": "halium-unlocked-recovery_suzu.img",
              "group": "firmware"
            }
          ],
          "group": "firmware"
        },
        {
          "type": "fastboot:reboot",
          "fallback_user_action": "boot",
          "group": "firmware"
        },
        {
          "type": "systemimage"
        },
        {
          "type": "adb:reboot",
          "to_state": "recovery",
          "fallback_user_action": "recovery"
        }
      ],
      "slideshow": []
    }
  ]
}

